{"bundle_id":"dbb9dcc3dbdb7c9c33764d04c6e0c15430163f63d34b18e71d6a2f5c6e1ac11d","competition_id":"allsvenskan","contains_raw_payloads":false,"expected":{"recompute_mode":"FIRST_ISOLATED_RECOMPUTE_THEN_SECOND_COMPARE","source_reference_sha256":"96e84030c9e48fe0c8f8d8125a2e89bf31b00200183e4b3fa4a1877016afb0cd"},"export_snapshot_identity_sha256":"d3744e6f37a2c772a1caa08a82163764f7eb72b1893b51f6b5e2516e035a5c66","file_receipts":[{"kind":"RAW_PAYLOAD","logical_path":"raw/01-status.json","sha256":"ee9953411477c79446ea1d6b489a592833719a921a2ea19f6563b7c16d92dc1f","size_bytes":285},{"kind":"RAW_PAYLOAD","logical_path":"raw/02-fixtures.json","sha256":"7b26f4e230d505768b12502f2956ba3d1eab7d37b9a6fd8c3e2b491ff7d09c40","size_bytes":17111},{"kind":"RAW_PAYLOAD","logical_path":"raw/03-odds.json","sha256":"68bdbc7a1e544229367deb2676e1668aea13fdebdcf1b53c7b24e38a6f190bf4","size_bytes":164611},{"kind":"RAW_PAYLOAD","logical_path":"raw/04-lineups.json","sha256":"8365d6be41a732f0687dc9bf9659e6c65dbc6d3b82db966364582c73e698830e","size_bytes":4210},{"kind":"SOURCE_CONTEXT","logical_path":"source/context.json","sha256":"2f440e137ad79ed0afef09d2a8bb2f9011f1130282a298d763cee85853a94478","size_bytes":59538},{"kind":"SOURCE_REFERENCE","logical_path":"source/reference.json","sha256":"96e84030c9e48fe0c8f8d8125a2e89bf31b00200183e4b3fa4a1877016afb0cd","size_bytes":648487}],"fixture_id_sha256":"d34d602e75a261cd0acccf0b37862b3bea2b2f8b21c16d7cdb1eec92fb529975","kickoff_utc":"2026-08-03T17:00:00Z","migration_head":"0050_gate_a_runtime_selection","private_bundle_schema_version":"w2.real-fixture-bundle.v1","schema_version":"w2.real-fixture-sanitized-manifest.v1","season":"2026","serializer_version":"w2.canonical-json.v2","source_git_sha":"ea5c314e0e2e7cccc93efbc10909dc8fdc104117"}
